{
  "name": "Silver Matrix",
  "image": "https://cryptostylematrix.github.io/frontend/sliver_matrix.jpeg",
  "creator": {
    "tg": "cryptostylematrix"
  },
  "features": [
    "clones",
    "structure management"
  ],
  "platforms": 2,
  "entry": {
    "price": 103,
    "currency": "USD",
    "kind": "fixed"
  },
  "incomes": [
    {
      "period": "program",
      "value": 1000,
      "currency": "USD",
      "kind": "minimum"
    }
  ],
  "presentations": {
    "pdf": {
      "de": "",
      "en": "",
      "es": "",
      "fr": "",
      "hu": "",
      "it": "",
      "kk": "",
      "pl": "",
      "pt": "",
      "ru": "",
      "uk": ""
    },
    "video": {
      "de": "",
      "en": "",
      "es": "",
      "fr": "",
      "hu": "",
      "it": "",
      "kk": "",
      "pl": "",
      "pt": "",
      "ru": "",
      "uk": ""
    }
  }
}
