{
  "name": "MULTI Matrix",
  "image": "https://cryptostylematrix.github.io/frontend/cs-big.png",
  "creator": {
    "tg": "cryptostylematrix"
  },
  "features": [
    "reinvest",
    "clones",
    "structure management"
  ],
  "platforms": 6,
  "entry": {
    "price": 15,
    "currency": "TON"
  },
  "incomes": [
    {
      "period": "program",
      "value": 3500,
      "currency": "TON"
    }
  ],
  "presentations": {
    "pdf": {
      "de": "https://cryptostylematrix.github.io/frontend/marketing-en.pdf",
      "en": "https://cryptostylematrix.github.io/frontend/marketing-en.pdf",
      "es": "https://cryptostylematrix.github.io/frontend/marketing-en.pdf",
      "fr": "https://cryptostylematrix.github.io/frontend/marketing-en.pdf",
      "hu": "https://cryptostylematrix.github.io/frontend/marketing-hu.pdf",
      "it": "https://cryptostylematrix.github.io/frontend/marketing-it.pdf",
      "kk": "https://cryptostylematrix.github.io/frontend/marketing-kk.pdf",
      "pl": "https://cryptostylematrix.github.io/frontend/marketing-pl.pdf",
      "pt": "https://cryptostylematrix.github.io/frontend/marketing-en.pdf",
      "ru": "https://cryptostylematrix.github.io/frontend/marketing-ru.pdf",
      "uk": "https://cryptostylematrix.github.io/frontend/marketing-uk.pdf"
    },
    "video": {
      "de": "https://www.youtube.com/@CryptoStyleOfficial",
      "en": "https://www.youtube.com/@CryptoStyleOfficial",
      "es": "https://www.youtube.com/@CryptoStyleOfficial",
      "fr": "https://www.youtube.com/@CryptoStyleOfficial",
      "hu": "https://www.youtube.com/@CryptoStyleOfficial",
      "it": "https://www.youtube.com/@CryptoStyleOfficial",
      "kk": "https://www.youtube.com/@CryptoStyleOfficial",
      "pl": "https://www.youtube.com/@CryptoStyleOfficial",
      "pt": "https://www.youtube.com/@CryptoStyleOfficial",
      "ru": "https://www.youtube.com/@CryptoStyleOfficial",
      "uk": "https://www.youtube.com/@CryptoStyleOfficial"
    }
  }
}
