{
  "name": "CryptoCash",
  "image": "https://cryptostylematrix.github.io/frontend/cryptocash.png",
  "creator": {
    "tg": "cryptostylematrix"
  },
  "features": [
    "compression",
    "system places",
    "cycles",
    "full-distribution"
  ],
  "platforms": 4,
  "entry": {
    "price": 10,
    "currency": "USDT"
  },
  "incomes": [{
    "period": "cycle",
    "value": 80000,
    "currency": "USDT"
  }],
  "presentations": {
    "pdf": {
      "de": "https://crypto-style.org/crypto-cash",
      "en": "https://crypto-style.org/crypto-cash",
      "es": "https://crypto-style.org/crypto-cash",
      "fr": "https://crypto-style.org/crypto-cash",
      "hu": "https://crypto-style.org/crypto-cash",
      "it": "https://crypto-style.org/crypto-cash",
      "kk": "https://crypto-style.org/crypto-cash",
      "pl": "https://crypto-style.org/crypto-cash",
      "pt": "https://crypto-style.org/crypto-cash",
      "ru": "https://crypto-style.org/crypto-cash",
      "uk": "https://crypto-style.org/crypto-cash"
    },
    "video": {
      "de": "",
      "en": "",
      "es": "",
      "fr": "",
      "hu": "https://www.youtube.com/@CryptoStyleOfficial",
      "it": "",
      "kk": "",
      "pl": "",
      "pt": "",
      "ru": "https://www.youtube.com/@CryptoStyleOfficial",
      "uk": "https://www.youtube.com/@CryptoStyleOfficial"
    }
  }
}
