{
  "name": "NEO Matrix",
  "image": "https://cryptostylematrix.github.io/frontend/neoclub.png",
  "creator": {
    "tg": "neoclubmatrix"
  },
  "features": [
    "linear",
    "tetra",
    "clones",
    "structure management"
  ],
  "platforms": 8,
  "entry": {
    "price": 155,
    "currency": "USD"
  },
  "incomes": [
    {
      "period": "program",
      "value": 72100,
      "currency": "USD"
    }
  ],
  "presentations": {
    "pdf": {
      "de": "https://cryptostylematrix.github.io/frontend/Neo-Club_de.pdf",
      "en": "https://cryptostylematrix.github.io/frontend/Neo-Club_en.pdf",
      "es": "https://cryptostylematrix.github.io/frontend/Neo-Club_es.pdf",
      "fr": "https://cryptostylematrix.github.io/frontend/Neo-Club_fr.pdf",
      "hu": "https://cryptostylematrix.github.io/frontend/Neo-Club_hu.pdf",
      "it": "https://cryptostylematrix.github.io/frontend/Neo-Club_it.pdf",
      "kk": "https://cryptostylematrix.github.io/frontend/Neo-Club_kk.pdf",
      "pl": "https://cryptostylematrix.github.io/frontend/Neo-Club_pl.pdf",
      "pt": "https://cryptostylematrix.github.io/frontend/Neo-Club_pt.pdf",
      "ru": "https://cryptostylematrix.github.io/frontend/Neo-Club_ru.pdf",
      "uk": "https://cryptostylematrix.github.io/frontend/Neo-Club_uk.pdf"
    },
    "video": {
      "de": "https://www.youtube.com/@CryptoStyleOfficial",
      "en": "https://www.youtube.com/@CryptoStyleOfficial",
      "es": "https://www.youtube.com/@CryptoStyleOfficial",
      "fr": "https://www.youtube.com/@CryptoStyleOfficial",
      "hu": "https://www.youtube.com/@CryptoStyleOfficial",
      "it": "https://www.youtube.com/@CryptoStyleOfficial",
      "kk": "https://www.youtube.com/@CryptoStyleOfficial",
      "pl": "https://www.youtube.com/@CryptoStyleOfficial",
      "pt": "https://www.youtube.com/@CryptoStyleOfficial",
      "ru": "https://www.youtube.com/@CryptoStyleOfficial",
      "uk": "https://www.youtube.com/@CryptoStyleOfficial"
    }
  }
}
